rule key,start line,end line,severity,message,type
java:S101,2,2,IDENTIFIABLE,Rename this class name to match the regular expression '^[A-Z][a-zA-Z0-9]*$'.,null,
java:S1104,4,4,MODULAR,Make context a static final constant or non-public and provide accessors if needed.,null,
java:S1220,null,null,MODULAR,Move this file to a named package.,null,
java:S1444,4,4,MODULAR,Make this "public static context" field final,null,
java:S2696,9,9,COMPLETE,Make the enclosing method "static" or remove this set.,null,
java:S1135,8,8,COMPLETE,Complete the task associated to this TODO comment.,null,
